{
  "kind": "validate",
  "suite": "validate/empty-assert.yml",
  "description": "An assertion entry with a subject and no comparison, beside a capture nobody reads.",
  "exitCode": 2,
  "diagnostics": [
    {
      "code": "W301",
      "severity": "warning",
      "line": 6,
      "column": 20
    },
    {
      "code": "E204",
      "severity": "error",
      "line": 8,
      "column": 9
    }
  ]
}