{
  "kind": "validate",
  "suite": "validate/core-import.yml",
  "description": "A catalog that imports bdd-suite:core and supports only csharp leaves no core action to the go binding.",
  "exitCode": 2,
  "schemaRoot": "schema-core-import",
  "bindingCheck": true,
  "binding": "go",
  "diagnostics": [
    { "code": "E201", "severity": "error", "line": 6, "column": 17 },
    { "code": "E201", "severity": "error", "line": 8, "column": 17 }
  ]
}
