{
  "kind": "validate",
  "suite": "validate/stable-vars.yml",
  "description": "Three non-deterministic functions in a vars block, and a function called with no arguments.",
  "exitCode": 2,
  "diagnostics": [
    {
      "code": "E309",
      "severity": "error",
      "line": 4,
      "column": 10
    },
    {
      "code": "E309",
      "severity": "error",
      "line": 5,
      "column": 14
    },
    {
      "code": "E309",
      "severity": "error",
      "line": 6,
      "column": 17
    },
    {
      "code": "E307",
      "severity": "error",
      "line": 12,
      "column": 16
    }
  ]
}